{
  "authoritative_R_i_tFG": "",
  "boundary_record_version": "historical-information-boundary-v2",
  "case_id": "CASE_97AFC2022473",
  "development_linkage_status": "unresolved",
  "historical_state_reconstructible": "unresolved",
  "materialization_status": "not_attempted",
  "methodology_version": "dir-tfg-v2",
  "object_validation_status": "not_attempted",
  "pr_component_status": "available_by_tFG",
  "pr_existed_by_tFG": "yes",
  "primary_repository_cutoff": "tFG",
  "provenance_references": [
    "https://api.github.com/repos/equinix/metal-cli/pulls/405"
  ],
  "reconstruction_contract_version": "post-stage-c-reconstruction-v2",
  "repository": "equinix/metal-cli",
  "tC": {
    "precision": "timestamp",
    "source": "first developer turn in parsed conversation",
    "status": "derivable",
    "value": "2023-12-13T16:35:42.372307+00:00"
  },
  "tFG": {
    "precision": "timestamp",
    "source": "turn_000003.create_time",
    "status": "derivable",
    "value": "2023-12-13T16:35:54.603014+00:00"
  },
  "target_identity_status": "unresolved",
  "temporal_applicability_status": "unresolved",
  "tree_identity": "",
  "tree_validation_status": "not_attempted"
}
