{
  "authoritative_R_i_tFG": "",
  "boundary_record_version": "historical-information-boundary-v2",
  "case_id": "CASE_F13F98792012",
  "development_linkage_status": "unresolved",
  "historical_state_reconstructible": "unresolved",
  "materialization_status": "not_attempted",
  "methodology_version": "dir-tfg-v2",
  "object_validation_status": "not_attempted",
  "pr_component_status": "available_by_tFG",
  "pr_existed_by_tFG": "yes",
  "primary_repository_cutoff": "tFG",
  "provenance_references": [
    "cases/reconstruction/CASE_F13F98792012/evidence/archive_derivation_leads_v2.json",
    "https://api.github.com/repos/agentcoinorg/evo.ninja/pulls/206"
  ],
  "reconstruction_contract_version": "post-stage-c-reconstruction-v2",
  "repository": "polywrap/evo.ninja",
  "tC": {
    "precision": "timestamp",
    "source": "first developer turn in parsed conversation",
    "status": "derivable",
    "value": "2023-09-25T11:59:01.557490+00:00"
  },
  "tFG": {
    "precision": "timestamp",
    "source": "turn_000003.create_time",
    "status": "derivable",
    "value": "2023-09-25T11:59:29.032600+00:00"
  },
  "target_identity_status": "unresolved",
  "temporal_applicability_status": "unresolved",
  "tree_identity": "",
  "tree_validation_status": "not_attempted"
}
