{
  "authoritative_R_i_tFG": "",
  "boundary_record_version": "historical-information-boundary-v2",
  "case_id": "CASE_F93FFAA22B9B",
  "development_linkage_status": "unresolved",
  "historical_state_reconstructible": "unresolved",
  "materialization_status": "not_attempted",
  "methodology_version": "dir-tfg-v2",
  "object_validation_status": "not_attempted",
  "pr_component_status": "available_by_tFG",
  "pr_existed_by_tFG": "yes",
  "primary_repository_cutoff": "tFG",
  "provenance_references": [
    "cases/reconstruction/CASE_F93FFAA22B9B/evidence/archive_derivation_leads_v2.json",
    "cases/reconstruction/CASE_F93FFAA22B9B/evidence/archive_derivation_leads_v2.json",
    "cases/reconstruction/CASE_F93FFAA22B9B/evidence/archive_derivation_leads_v2.json",
    "cases/reconstruction/CASE_F93FFAA22B9B/evidence/archive_derivation_leads_v2.json",
    "cases/reconstruction/CASE_F93FFAA22B9B/evidence/archive_derivation_leads_v2.json",
    "cases/reconstruction/CASE_F93FFAA22B9B/evidence/archive_derivation_leads_v2.json",
    "cases/reconstruction/CASE_F93FFAA22B9B/evidence/archive_derivation_leads_v2.json",
    "cases/reconstruction/CASE_F93FFAA22B9B/evidence/archive_derivation_leads_v2.json",
    "cases/reconstruction/CASE_F93FFAA22B9B/evidence/archive_derivation_leads_v2.json",
    "cases/reconstruction/CASE_F93FFAA22B9B/evidence/archive_derivation_leads_v2.json",
    "cases/reconstruction/CASE_F93FFAA22B9B/evidence/archive_derivation_leads_v2.json",
    "cases/reconstruction/CASE_F93FFAA22B9B/evidence/archive_derivation_leads_v2.json",
    "cases/reconstruction/CASE_F93FFAA22B9B/evidence/archive_derivation_leads_v2.json",
    "cases/reconstruction/CASE_F93FFAA22B9B/evidence/archive_derivation_leads_v2.json",
    "cases/reconstruction/CASE_F93FFAA22B9B/evidence/archive_derivation_leads_v2.json",
    "cases/reconstruction/CASE_F93FFAA22B9B/evidence/archive_derivation_leads_v2.json",
    "cases/reconstruction/CASE_F93FFAA22B9B/evidence/archive_derivation_leads_v2.json",
    "cases/reconstruction/CASE_F93FFAA22B9B/evidence/archive_derivation_leads_v2.json",
    "cases/reconstruction/CASE_F93FFAA22B9B/evidence/archive_derivation_leads_v2.json",
    "cases/reconstruction/CASE_F93FFAA22B9B/evidence/archive_derivation_leads_v2.json",
    "cases/reconstruction/CASE_F93FFAA22B9B/evidence/archive_derivation_leads_v2.json",
    "cases/reconstruction/CASE_F93FFAA22B9B/evidence/archive_derivation_leads_v2.json",
    "cases/reconstruction/CASE_F93FFAA22B9B/evidence/archive_derivation_leads_v2.json",
    "cases/reconstruction/CASE_F93FFAA22B9B/evidence/archive_derivation_leads_v2.json",
    "cases/reconstruction/CASE_F93FFAA22B9B/evidence/archive_derivation_leads_v2.json",
    "cases/reconstruction/CASE_F93FFAA22B9B/evidence/archive_derivation_leads_v2.json",
    "cases/reconstruction/CASE_F93FFAA22B9B/evidence/archive_derivation_leads_v2.json",
    "cases/reconstruction/CASE_F93FFAA22B9B/evidence/archive_derivation_leads_v2.json",
    "cases/reconstruction/CASE_F93FFAA22B9B/evidence/archive_derivation_leads_v2.json",
    "cases/reconstruction/CASE_F93FFAA22B9B/evidence/archive_derivation_leads_v2.json",
    "cases/reconstruction/CASE_F93FFAA22B9B/evidence/archive_derivation_leads_v2.json",
    "cases/reconstruction/CASE_F93FFAA22B9B/evidence/archive_derivation_leads_v2.json",
    "cases/reconstruction/CASE_F93FFAA22B9B/evidence/archive_derivation_leads_v2.json",
    "cases/reconstruction/CASE_F93FFAA22B9B/evidence/archive_derivation_leads_v2.json",
    "cases/reconstruction/CASE_F93FFAA22B9B/evidence/archive_derivation_leads_v2.json",
    "cases/reconstruction/CASE_F93FFAA22B9B/evidence/archive_derivation_leads_v2.json",
    "cases/reconstruction/CASE_F93FFAA22B9B/evidence/archive_derivation_leads_v2.json",
    "cases/reconstruction/CASE_F93FFAA22B9B/evidence/archive_derivation_leads_v2.json",
    "https://api.github.com/repos/dotCMS/core/pulls/25432"
  ],
  "reconstruction_contract_version": "post-stage-c-reconstruction-v2",
  "repository": "dotCMS/core",
  "tC": {
    "precision": "timestamp",
    "source": "first developer turn in parsed conversation",
    "status": "derivable",
    "value": "2023-07-07T21:09:50.169989+00:00"
  },
  "tFG": {
    "precision": "timestamp",
    "source": "turn_000003.create_time",
    "status": "derivable",
    "value": "2023-07-07T21:10:15.086839+00:00"
  },
  "target_identity_status": "unresolved",
  "temporal_applicability_status": "unresolved",
  "tree_identity": "",
  "tree_validation_status": "not_attempted"
}
